{
    "catalog":  {
                    "id":  "honua-ogc-sample",
                    "title":  "Honua OGC Sample Catalog",
                    "description":  "Sample metadata for OGC API Features development",
                    "version":  "2025.09",
                    "links":  [
                                  {
                                      "href":  "https://ogcapi.ogc.org/features/",
                                      "rel":  "about",
                                      "type":  "text/html",
                                      "title":  "OGC API Features"
                                  }
                              ],
                    "keywords":  [
                                     "ogc",
                                     "features",
                                     "sample"
                                 ]
                },
    "folders":  [
                    {
                        "id":  "transportation",
                        "title":  "Transportation",
                        "order":  10
                    }
                ],
    "dataSources":  [
                        {
                            "id":  "postgres-primary",
                            "provider":  "postgis",
                            "connectionString":  "Host=localhost;Database=honua;Username=honua;Password=secret"
                        }
                    ],
    "services":  [
                     {
                         "id":  "roads",
                         "title":  "Road Centerlines",
                         "folderId":  "transportation",
                         "serviceType":  "feature",
                         "dataSourceId":  "postgres-primary",
                         "enabled":  true,
                         "description":  "Transportation datasets for sample OGC API",
                         "keywords":  [
                                          "transportation",
                                          "roads"
                                      ],
                         "links":  [
                                       {
                                           "href":  "https://example.org/datasets/roads",
                                           "rel":  "collection",
                                           "type":  "text/html",
                                           "title":  "Roads Overview"
                                       }
                                   ],
                         "ogc":  {
                                     "collectionsEnabled":  true,
                                     "itemLimit":  1000,
                                     "defaultCrs":  "http://www.opengis.net/def/crs/OGC/1.3/CRS84",
                                     "additionalCrs":  [
                                                           "http://www.opengis.net/def/crs/EPSG/0/3857"
                                                       ],
                                     "conformanceClasses":  [
                                                                "http://www.opengis.net/spec/ogcapi-features-1/1.0/conf/core",
                                                                "http://www.opengis.net/spec/ogcapi-features-1/1.0/conf/geojson",
                                                                "http://www.opengis.net/spec/ogcapi-features-1/1.0/conf/oas30",
                                                                "http://www.opengis.net/spec/ogcapi-features-1/1.0/conf/crs",
                                                                "http://www.opengis.net/spec/ogcapi-features-1/1.0/conf/crs-bbox",
                                                                "http://www.opengis.net/spec/ogcapi-features-1/1.0/conf/crs-query",
                                                                "http://www.opengis.net/spec/ogcapi-features-2/1.0/conf/crs",
                                                                "http://www.opengis.net/spec/ogcapi-features-2/1.0/conf/crs-bbox",
                                                                "http://www.opengis.net/spec/ogcapi-features-2/1.0/conf/crs-query"
                                                            ]
                                 }
                     }
                 ],
    "layers":  [
                   {
                       "id":  "roads-primary",
                       "serviceId":  "roads",
                       "title":  "Primary Roads",
                       "description":  "Major roadways extracted from the Simple Features sample bundle",
                       "geometryType":  "LineString",
                       "idField":  "road_id",
                       "displayField":  "name",
                       "geometryField":  "geom",
                       "crs":  [
                                   "http://www.opengis.net/def/crs/OGC/1.3/CRS84",
                                   "http://www.opengis.net/def/crs/EPSG/0/3857"
                               ],
                       "keywords":  [
                                        "roads",
                                        "transport"
                                    ],
                       "links":  [
                                     {
                                         "href":  "https://example.org/collections/roads::roads-primary",
                                         "rel":  "self",
                                         "type":  "application/json",
                                         "title":  "Primary Roads"
                                     }
                                 ],
                       "extent":  {
                                      "bbox":  [
                                                   [
                                                       -122.6,
                                                       45.5,
                                                       -122.3,
                                                       45.7
                                                   ]
                                               ],
                                      "crs":  "http://www.opengis.net/def/crs/OGC/1.3/CRS84"
                                  },
                       "query":  {
                                     "maxRecordCount":  1000,
                                     "supportedParameters":  [
                                                                 "bbox",
                                                                 "limit",
                                                                 "offset",
                                                                 "datetime"
                                                             ]
                                 },
                       "storage":  {
                                       "table":  "roads_primary",
                                       "geometryColumn":  "geom",
                                       "primaryKey":  "road_id",
                                       "temporalColumn":  "observed_at",
                                       "srid":  4326
                                   },
                       "fields":  [
                                      {
                                          "name":  "road_id",
                                          "type":  "int64",
                                          "storageType":  "integer",
                                          "nullable":  false,
                                          "editable":  false
                                      },
                                      {
                                          "name":  "name",
                                          "type":  "string",
                                          "storageType":  "text",
                                          "nullable":  true,
                                          "editable":  true,
                                          "maxLength":  255
                                      },
                                      {
                                          "name":  "geom",
                                          "type":  "geometry",
                                          "storageType":  "geometry",
                                          "nullable":  true,
                                          "editable":  true
                                      },
                                      {
                                          "name":  "observed_at",
                                          "type":  "dateTimeOffset",
                                          "storageType":  "timestamp",
                                          "nullable":  true,
                                          "editable":  true
                                      }
                                  ]
                   }
               ]
}
